{
  "protocol_version": "zodex.remote-approval.v1",
  "request_id": "1f40fb52-3957-4f08-9016-84b2c526376b",
  "nonce": "MDEyMzQ1Njc4OWFiY2RlZg",
  "issued_at": "2026-08-22T10:00:00Z",
  "expires_at": "2026-08-22T10:05:00Z",
  "active_device_epoch": 7,
  "host": {"host_id": "desktop-01", "signing_key_id": "host-sign-2026-08", "encryption_key_id": "host-hpke-2026-08"},
  "action": {"kind": "user_input", "title": "Deploy to production?", "summary": "Confirm deployment to production", "input": {"type": "boolean"}},
  "action_digest": "c2d068a2e23b27642271f29a402e512be2af566565efa75a892035aef86661ea",
  "host_signature": "AAAAAAAAAAAAAAAAAAAAAAAAAAAAAAAAAAAAAAAAAAAAAAAAAAAAAAAAAAAAAAAAAAAAAAAAAAAAAAAAAAAAAA"
}
