{
  "protocol_version": "zodex.remote-approval.v1",
  "request_id": "1f40fb52-3957-4f08-9016-84b2c526376b",
  "nonce": "MDEyMzQ1Njc4OWFiY2RlZg",
  "issued_at": "2026-08-22T10:00:00Z",
  "expires_at": "2026-08-22T10:05:00Z",
  "active_device_epoch": 7,
  "host": {"host_id": "desktop-01", "signing_key_id": "host-sign-2026-08", "encryption_key_id": "host-hpke-2026-08"},
  "action": {"kind": "user_input", "title": "Select environment", "summary": "Select target environment", "input": {"type": "enum", "choices": [{"id": "opt_a", "label": "Option A"}, {"id": "opt_b", "label": "Option B"}]}},
  "action_digest": "3d67eda8600d1cc112b602ff068cebe7e85958bfc69b1b80e3097f40551ec6a9",
  "host_signature": "AAAAAAAAAAAAAAAAAAAAAAAAAAAAAAAAAAAAAAAAAAAAAAAAAAAAAAAAAAAAAAAAAAAAAAAAAAAAAAAAAAAAAA"
}
