{
  "protocol_version": "zodex.remote-approval.v1",
  "request_id": "1f40fb52-3957-4f08-9016-84b2c526376b",
  "nonce": "MDEyMzQ1Njc4OWFiY2RlZg",
  "issued_at": "2026-08-22T10:00:00Z",
  "expires_at": "2026-08-22T10:05:00Z",
  "active_device_epoch": 7,
  "host": {"host_id": "desktop-01", "signing_key_id": "host-sign-2026-08", "encryption_key_id": "host-hpke-2026-08"},
  "action": {"kind": "file_change", "title": "Modify main.rs", "summary": "Updates main entrypoint", "operation": "modify", "paths": ["/home/user/project/src/main.rs"]},
  "action_digest": "38d278a2005f4cfe8e676952c8dfdd08c0c67442c8c319867f9a402c4a37a3bb",
  "host_signature": "AAAAAAAAAAAAAAAAAAAAAAAAAAAAAAAAAAAAAAAAAAAAAAAAAAAAAAAAAAAAAAAAAAAAAAAAAAAAAAAAAAAAAA"
}
