{
  "protocol_version": "zodex.remote-approval.v1",
  "request_id": "1f40fb52-3957-4f08-9016-84b2c526376b",
  "nonce": "MDEyMzQ1Njc4OWFiY2RlZg",
  "issued_at": "2026-08-22T10:00:00Z",
  "expires_at": "2026-08-22T10:05:00Z",
  "active_device_epoch": 7,
  "host": {"host_id": "desktop-01", "signing_key_id": "host-sign-2026-08", "encryption_key_id": "host-hpke-2026-08"},
  "action": {"kind": "permission", "title": "Grant filesystem access", "summary": "Grant write access to project folder", "permission": "filesystem.write", "scope": "/home/user/project"},
  "action_digest": "09a5a89b65f5a1e2aa7d78cb1c2d19c04c48a3cd1cb21392690caf252073d702",
  "host_signature": "AAAAAAAAAAAAAAAAAAAAAAAAAAAAAAAAAAAAAAAAAAAAAAAAAAAAAAAAAAAAAAAAAAAAAAAAAAAAAAAAAAAAAA"
}
